{
  "schema_version": "v1",
  "population_id": "dolved-care-engineering-threshold_calibration-2",
  "population_digest": "bafc720dbf03aba9e3fdee597ba0b9f2bfaa38db5adc8502b88bf68d07c57345",
  "benchmark_id": "dolved-care-engineering",
  "benchmark_version": "3",
  "benchmark_digest": "8a90b0e6da531223ab6f113f237c2bde3149690662a5a4f1f3cbd5f921c0acd7",
  "split_name": "threshold_calibration",
  "split_version": "2",
  "split_case_ids_digest": "1808477d771b24f45b726dd4b05ce8defa5b1edc624b8907155ccac7ab7e4801",
  "case_count": 44,
  "variant_count": 132,
  "case_ids_digest": "1808477d771b24f45b726dd4b05ce8defa5b1edc624b8907155ccac7ab7e4801",
  "slice_case_counts": {
    "COMPARE": 10,
    "CURRENT": 22,
    "VALID_AT_DATE": 6,
    "adversarial": 5,
    "applicability": 6,
    "historical": 6,
    "location-alias": 6,
    "multi-document": 4,
    "multi-evidence": 15,
    "never-authoritative": 2,
    "predecessor-resurrection": 1,
    "region-specific": 2,
    "regional-applicability": 3,
    "scheduled-future": 5,
    "site-specific": 1,
    "temporal-authority": 31,
    "withdrawn": 1,
    "zero-evidence": 10
  },
  "domain_case_counts": {
    "complaints": 4,
    "fire-safety": 5,
    "gdpr": 4,
    "health-safety": 4,
    "hr": 4,
    "infection-control": 3,
    "medication": 4,
    "payroll": 4,
    "safeguarding": 4,
    "training": 4,
    "visitors": 4
  },
  "expected_outcome_case_counts": {
    "COMPARISON_SCOPE_INCOMPLETE": 4,
    "EVIDENCE_FOUND": 34,
    "INSUFFICIENT_EVIDENCE": 5,
    "NO_ELIGIBLE_EVIDENCE": 1
  },
  "benchmark_taxonomy": {
    "intrinsic_slices_schema_version": "v3-taxonomy-1",
    "declared_intrinsic_slices": [
      "COMPARE",
      "CURRENT",
      "VALID_AT_DATE",
      "adversarial",
      "applicability",
      "applicability-context",
      "historical",
      "location-alias",
      "multi-document",
      "multi-evidence",
      "never-authoritative",
      "predecessor-resurrection",
      "region-specific",
      "regional-applicability",
      "scheduled-future",
      "site-specific",
      "temporal-authority",
      "withdrawn",
      "zero-evidence"
    ],
    "intrinsic_slices_digest": "7cef962db94df8f9bc13c228c254dc0e1491f65aa4eaa70963ad8643fbde816e",
    "evaluation_facets_schema_version": "v3-taxonomy-1",
    "declared_evaluation_facets": [
      "abbreviation",
      "after-authority-transition",
      "alias-colloquial",
      "alias-formal",
      "ambiguous-location",
      "applicability-excluded",
      "before-authority-transition",
      "changed-instruction",
      "changed-structured-value",
      "clarification-required",
      "colloquial",
      "compare-comparison-empty",
      "compare-primary-empty",
      "conflicting-guidance",
      "cross-document-completeness",
      "form-evidence",
      "historical-explicit",
      "historical-ordinal",
      "historical-previous",
      "keyword-stuffing",
      "long-form",
      "near-duplicate",
      "near-duplicate-wrong",
      "negative-instruction",
      "never-authoritative",
      "no-predecessor-resurrection",
      "no-trustworthy-candidate",
      "numeric-boundary",
      "regional",
      "scheduled",
      "site-specific",
      "table-evidence",
      "three-plus-evidence-units",
      "two-evidence-units",
      "universal",
      "unresolved-location",
      "withdrawn"
    ],
    "evaluation_facets_digest": "d93fe1743a5b845eeb4364fedff03c9c9607a1105ba3bc9092440820310acc76"
  },
  "independence": {
    "calibration_case_ids_digest": "1808477d771b24f45b726dd4b05ce8defa5b1edc624b8907155ccac7ab7e4801",
    "calibration_semantic_cluster_ids_digest": "d4ab378d0e82029c02ababadf7aef4ef34abe95c040eb1c556a3643716a0ba40",
    "engineering_case_ids_digest": "4f53cda18c2baa0c0354bb5f9a3ecbe5ed12ab4d8e11ba873c2f11161202b945",
    "engineering_semantic_cluster_ids_digest": "4f53cda18c2baa0c0354bb5f9a3ecbe5ed12ab4d8e11ba873c2f11161202b945",
    "held_out_case_ids_digest": "4f53cda18c2baa0c0354bb5f9a3ecbe5ed12ab4d8e11ba873c2f11161202b945",
    "held_out_semantic_cluster_ids_digest": "4f53cda18c2baa0c0354bb5f9a3ecbe5ed12ab4d8e11ba873c2f11161202b945",
    "comparison_method": "canonical-identity-set-intersection",
    "comparison_method_version": "1",
    "engineering_overlap_case_ids": [],
    "held_out_overlap_case_ids": [],
    "split_semantic_cluster_ids": [],
    "engineering_overlap_case_count": 0,
    "held_out_overlap_case_count": 0,
    "split_semantic_cluster_count": 0,
    "score_driven_selection": false,
    "post_result_reassignment": false,
    "population_frozen_before_provider_execution": true
  },
  "authoring_review": {
    "review_artifact_id": "review.dolved-care-engineering.v3.calibration-v1",
    "review_artifact_version": "1",
    "review_artifact_digest": "bb2ce88acf19a4bcbb7ce00ab8154c73d48536afcb6d1f9affce660d30152c93",
    "reviewed_case_ids_digest": "1808477d771b24f45b726dd4b05ce8defa5b1edc624b8907155ccac7ab7e4801",
    "semantic_quality_reviewed": true,
    "representative_coverage_reviewed": true,
    "author_rationale_reviewed": true,
    "governance_reviewed": true
  },
  "pipeline_failure_counts": [],
  "cases": [
    {
      "case_id": "v3.complaints.compare.handling-timescales",
      "cluster_id": "cluster.v3.complaints.compare.handling-timescales",
      "domain": "complaints",
      "document_family_ids": [
        "family.complaints.handling"
      ],
      "evaluation_facets": [
        "changed-structured-value",
        "historical-explicit",
        "two-evidence-units"
      ],
      "variant_count": 3,
      "slices": [
        "COMPARE",
        "multi-evidence",
        "temporal-authority"
      ],
      "expected_outcome": "EVIDENCE_FOUND",
      "expected_evidence_unit_count": 2,
      "source_lineage_count": 2,
      "source_lineage_digest": "91a99c4e2f2f0454ae2d8bf8eef48e66d57851af616fc31ecbba8aba164c5a88"
    },
    {
      "case_id": "v3.complaints.compare.response-plan-incomplete",
      "cluster_id": "cluster.v3.complaints.compare.response-plan-incomplete",
      "domain": "complaints",
      "document_family_ids": [
        "family.complaints.handling"
      ],
      "evaluation_facets": [
        "changed-instruction",
        "compare-comparison-empty",
        "no-trustworthy-candidate"
      ],
      "variant_count": 3,
      "slices": [
        "COMPARE",
        "temporal-authority",
        "zero-evidence"
      ],
      "expected_outcome": "COMPARISON_SCOPE_INCOMPLETE",
      "expected_evidence_unit_count": 1,
      "source_lineage_count": 1,
      "source_lineage_digest": "c394aa9ff4953fab48a50619177bdc755eca334bf9ff76670270f885589e60af"
    },
    {
      "case_id": "v3.complaints.current.handling-deadlines",
      "cluster_id": "cluster.v3.complaints.current.handling-deadlines",
      "domain": "complaints",
      "document_family_ids": [
        "family.complaints.handling"
      ],
      "evaluation_facets": [
        "changed-structured-value",
        "conflicting-guidance",
        "near-duplicate-wrong",
        "two-evidence-units"
      ],
      "variant_count": 3,
      "slices": [
        "CURRENT",
        "adversarial",
        "multi-evidence",
        "temporal-authority"
      ],
      "expected_outcome": "EVIDENCE_FOUND",
      "expected_evidence_unit_count": 1,
      "source_lineage_count": 1,
      "source_lineage_digest": "c394aa9ff4953fab48a50619177bdc755eca334bf9ff76670270f885589e60af"
    },
    {
      "case_id": "v3.complaints.historical.handling-v1",
      "cluster_id": "cluster.v3.complaints.historical.handling-v1",
      "domain": "complaints",
      "document_family_ids": [
        "family.complaints.handling"
      ],
      "evaluation_facets": [
        "changed-structured-value",
        "historical-explicit",
        "historical-previous"
      ],
      "variant_count": 3,
      "slices": [
        "historical",
        "temporal-authority"
      ],
      "expected_outcome": "EVIDENCE_FOUND",
      "expected_evidence_unit_count": 1,
      "source_lineage_count": 1,
      "source_lineage_digest": "cae69505cb5c0f38d311476dcfec2ab4887e5367ef335d1f35ad4823456642ae"
    },
    {
      "case_id": "v3.fire.compare.drill-frequency",
      "cluster_id": "cluster.v3.fire.compare.drill-frequency",
      "domain": "fire-safety",
      "document_family_ids": [
        "family.fire.drills"
      ],
      "evaluation_facets": [
        "changed-structured-value",
        "historical-explicit",
        "near-duplicate",
        "two-evidence-units"
      ],
      "variant_count": 3,
      "slices": [
        "COMPARE",
        "multi-evidence",
        "temporal-authority"
      ],
      "expected_outcome": "EVIDENCE_FOUND",
      "expected_evidence_unit_count": 2,
      "source_lineage_count": 2,
      "source_lineage_digest": "0e0f57d1990a52708e6bc52d9e0d24bbabcb533847ccc9542539b6989f8e488f"
    },
    {
      "case_id": "v3.fire.compare.route-record-incomplete",
      "cluster_id": "cluster.v3.fire.compare.route-record-incomplete",
      "domain": "fire-safety",
      "document_family_ids": [
        "family.fire.drills"
      ],
      "evaluation_facets": [
        "changed-instruction",
        "compare-comparison-empty",
        "no-trustworthy-candidate"
      ],
      "variant_count": 3,
      "slices": [
        "COMPARE",
        "temporal-authority",
        "zero-evidence"
      ],
      "expected_outcome": "COMPARISON_SCOPE_INCOMPLETE",
      "expected_evidence_unit_count": 1,
      "source_lineage_count": 1,
      "source_lineage_digest": "cb82f8efa08298abd8adffd3e1d9e786457145e2ed8e68483194afcb970b2219"
    },
    {
      "case_id": "v3.fire.current.harbour-view-evacuation",
      "cluster_id": "cluster.v3.fire.current.harbour-view-evacuation",
      "domain": "fire-safety",
      "document_family_ids": [
        "family.fire.harbour-view-evacuation",
        "family.fire.north-west-evacuation",
        "family.fire.south-west-evacuation"
      ],
      "evaluation_facets": [
        "alias-colloquial",